{
  "$schema": "../../core/version.schema.json",
  "component": "api",
  "name": "uDOS API Extension",
  "version": {
    "major": 1,
    "minor": 0,
    "patch": 1
  },
  "display": "v1.0.1",
  "channel": "alpha",
  "released": "2026-01-10",
  "description": "REST API server - 144 endpoints, WebSocket streaming, command routing",
  "changelog": "dev/roadmap/CHANGELOG-api.md",
  "dependencies": {
    "core": ">=1.0.0",
    "flask": ">=2.0.0",
    "flask-socketio": ">=5.0.0"
  },
  "metadata": {
    "port": 5001,
    "protocol": "http/ws"
  }
}